,title,category,url
0,Should You Get Your Flu Shot and COVID Booster in Different Arms?,Coronavirus News,https://www.verywellhealth.com/flu-shot-covid-booster-different-arms-6742802
1,Anxiety Screenings Could Become a Normal Part of Your Annual Physical,Health News,https://www.verywellhealth.com/routine-anxiety-screening-6743203
2,Can a Daily Multivitamin Improve Memory in Older Adults?,Health News,https://www.verywellhealth.com/study-multivitamins-improve-cognition-6741085
3,Tracker: Polio in the U.S.,Health News,https://www.verywellhealth.com/polio-case-tracker-6374398
4,Monkeypox by the Numbers,Health News,https://www.verywellhealth.com/monkeypox-rates-by-state-6272347
5,The Preventive Health Issue Featuring Jonathan Van Ness,The Digital Issue,https://www.verywellhealth.com/the-preventive-health-issue-featuring-jonathan-van-ness-5323939
