,title,category,url
0,Norovirus Cases Are Spiking Nationwide: How to Protect Yourself from the Stomach Bug,Health News,https://www.verywellhealth.com/norovirus-on-the-rise-ways-to-protect-yourself-8769844
1,The First Steps to Managing Crohn’s Disease,Feature,https://www.verywellhealth.com/the-first-steps-to-managing-crohns-disease-8740759
2,"Cold, Flu, or Something Else? Know the Symptoms of Common Winter Bugs",Health News,https://www.verywellhealth.com/winter-bug-8770217
3,The 9 Best Magnesium Supplements of 2024,Nutrition Products & Services,https://www.verywellhealth.com/best-magnesium-supplements-8579258
4,6 Tips To Help You Stay on Track With Your New Year's Goals,Health News,https://www.verywellhealth.com/how-to-stick-to-new-year-resolutions-8773265
