,title,category,url
0,Living Fully With Metastatic Breast Cancer,Cancer,https://www.verywellhealth.com/living-with-metastatic-breast-cancer-8787598
1,What's New in Alzheimer's Treatment?,Feature,https://www.verywellhealth.com/whats-new-in-alzheimers-treatment-8772887
2,Low Vaccination Rates Fuel Texas' Largest Measles Outbreak in 30 Years,Health News,https://www.verywellhealth.com/measles-outbreak-texas-11682808
3,Egg Prices Are Soaring—Here Are 4 High-Protein Breakfast Swaps,Diet and Nutrition,https://www.verywellhealth.com/eggflation-protein-alternatives-11683788
4,A 35-Year-Old Marathoner Was Healthy and Fit—Then He Got Colorectal Cancer,Cancer,https://www.verywellhealth.com/marathon-runner-colorectal-cancer-screening-11682978
