,title,category,url
0,What Are the Symptoms of Monkeypox?,Health News,https://www.verywellhealth.com/monkeypox-symptoms-5324470
1,What Does It Mean to Grow Up With Gun Violence?,Health News,https://www.verywellhealth.com/gun-violence-child-trauma-5324427
2,Meet the Chiropractors Sharing Pain Relief Tips on TikTok,Health News,https://www.verywellhealth.com/tiktok-chiropractors-5324401
3,Is Cancer Remission the Same as a Cure?,Cancer,https://www.verywellhealth.com/cancer-remission-5090028
4,What Treatments Work Best for HER2-Positive Breast Cancer?,Cancer,https://www.verywellhealth.com/treatments-for-her2-positive-breast-cancer-4149987
