,title,category,url
0,Meet the Hispanic Community Leaders Breaking Down Barriers to COVID Vaccines,Coronavirus News,https://www.verywellhealth.com/hispanic-latino-vaccination-rates-7967845
1,Can You Get Enough Melatonin in Food for Better Sleep?,Health News,https://www.verywellhealth.com/melatonin-food-sources-7970443
2,Are You at Risk of High Blood Pressure From COVID?,Health News,https://www.verywellhealth.com/covid-causes-new-high-blood-pressure-7970796
3,Here's How Much Protein You Need Per Day,Diet and Nutrition,https://www.verywellhealth.com/how-much-protein-do-i-need-a-day-7968093
4,How to Choose a Birth Control Pill for Acne,Skin Health,https://www.verywellhealth.com/birth-control-for-acne-7567439
5,The Aging Well Issue featuring Fran Drescher,Digital Issue,https://www.verywellhealth.com/the-aging-well-issue-featuring-fran-drescher-6824283
