,title,category,url
0,Getting Enough Sleep May Offset Heart Disease Risk Factors,Health News,https://www.verywellhealth.com/sleep-heart-disease-5219801
1,CDC Loosens Mask Recommendations,Coronavirus News,https://www.verywellhealth.com/cdc-drops-mask-guidance-5220373
2,'Return to Normal' Leaves Immunocompromised People Behind,Coronavirus News,https://www.verywellhealth.com/return-to-normal-pandemic-immunocompromised-5219689
3,Common Causes of Vision Loss,Eye Health,https://www.verywellhealth.com/vision-loss-5094948
4,Drones Could Soon Deliver Medications to Your Home,Health News,https://www.verywellhealth.com/drones-medications-delivery-5219050
