,title,category,url
0,Will We Wear Face Masks Forever?,Coronavirus News,https://www.verywellhealth.com/face-masks-forever-5214041
1,How to Order Your Free COVID Test From the Government,Coronavirus News,https://www.verywellhealth.com/biden-administration-to-start-shipping-free-covid-tests-5216100
2,What Does Omicron Look Like in Kids?,Coronavirus News,https://www.verywellhealth.com/omicron-kids-symptoms-5216175
3,Dementia Cases Expected to Triple by 2050,Health News,https://www.verywellhealth.com/dementia-prevalence-expected-to-triple-by-2050-5216072
4,Is Diabetes Genetic?,Type 2 Diabetes,https://www.verywellhealth.com/is-diabetes-genetic-5112506
