,title,category,url
0,We Asked a Dietitian What the New Food Pyramid Gets Right and Wrong,Diet and Nutrition,https://www.verywellhealth.com/inverted-food-pyramid-11881904
1,Are You Struggling to Cut Back on Alcohol? Try Damp January,Dry January,https://www.verywellhealth.com/damp-january-explainer-7096983
2,We Asked a Doctor If Creatine Really Works Like a Steroid,Supplements,https://www.verywellhealth.com/is-creatine-a-steroid-11866974
3,Easy Protein Snacks That Aren't a Bar or Shake,Diet and Nutrition,https://www.verywellhealth.com/high-protein-snacks-11858485
4,How an Electric Toothbrush Could Improve Your Oral Health,Dental Health,https://www.verywellhealth.com/electric-toothbrush-benefits-11853299
