,title,category,url
0,Psoriasis and Your Life: A Guide to Daily Well-Being,Skin Health,https://www.verywellhealth.com/psoriasis-and-your-life-8651825
1,Menopause and Black Women,Health Divide,https://www.verywellhealth.com/health-divide-menopause-and-black-women-7498526
2,Caregivers Can Soon Call Uber Rides for Seniors,Health News,https://www.verywellhealth.com/uber-caregiver-8653502
3,How to Sleep Better in Hot Weather,Health News,https://www.verywellhealth.com/sleeping-in-hot-weather-8652716
4,10 Best Vegan Multivitamins & Supplements,Nutrition Products & Services,https://www.verywellhealth.com/best-vegan-multivitamins-and-supplements-8645822
