,title,category,url
0,Immunocompromised Individuals and People 50+ Can Now Get a Second Booster,Coronavirus News,https://www.verywellhealth.com/second-booster-50-and-above-immunocompromised-5223974
1,How Uninsured Patients Can Search for COVID-19 Testing and Care,Coronavirus News,https://www.verywellhealth.com/covid-uninsured-program-testing-treatment-options-5224014
2,Can COVID-19 Tests Detect the BA.2 Variant?,Coronavirus News,https://www.verywellhealth.com/omicron-subvariant-covid-testing-5224021
3,How to Prevent Your Migraines,Brain & Nervous System,https://www.verywellhealth.com/migraine-prevention-4583158
4,How Do I Treat My Dry Eyes?,Eye Health,https://www.verywellhealth.com/dry-eye-treatment-5112001
