,title,category,url
0,How to Choose a Non-Toxic Sunscreen That Actually Works,Health News,https://www.verywellhealth.com/how-to-choose-a-protective-sunscreen-for-the-summer-5323528
1,You Most Likely Won't Need the Monkeypox Vaccine,Health News,https://www.verywellhealth.com/what-you-need-to-know-about-the-monkeypox-vaccine-5323632
2,Is Your Data Safe in Period Tracking Apps?,Health News,https://www.verywellhealth.com/how-safe-are-period-trackers-in-a-post-roe-world-5323439
3,Metastatic Breast Cancer Support Communities,Cancer,https://www.verywellhealth.com/metastatic-breast-cancer-support-communities-4154813
4,Symptoms of Hepatitis C,Hepatitis,https://www.verywellhealth.com/hepatitis-c-symptoms-4070468
