,title,category,url
0,A Verywell Report: Insulin Price Cuts Barely Move the Needle for Americans,Health News,https://www.verywellhealth.com/american-cost-of-insulin-after-price-cuts-report-7483240
1,The 10 Best Tweezers of 2023,Skin & Hair Products,https://www.verywellhealth.com/best-tweezers-5189695
2,Do Spray Sunscreens Actually Work?,Health News,https://www.verywellhealth.com/do-spray-sunscreens-actually-work-well-7484834
3,New Recommendations for Breast Cancer Screening,Health News,https://www.verywellhealth.com/black-women-earlier-breast-cancer-screening-study-7485409
4,Overview of the Diverticulitis Diet,Digestive Health,https://www.verywellhealth.com/what-to-eat-for-diverticulosis-1944730
5,The Preventive Health Issue Featuring Jonathan Van Ness,Digital Issue,https://www.verywellhealth.com/the-preventive-health-issue-featuring-jonathan-van-ness-5323939
