,title,category,url
0,Do Cold Medicines Even Work? Here's What Experts Say,Health News,https://www.verywellhealth.com/do-cold-medicines-even-work-8413285
1,The Verywell Health Impact Awards,Health Advocates,https://www.verywellhealth.com/impact-awards-2023-7969442
2,Is There Such a Thing as Healthy Sugar?,Health News,https://www.verywellhealth.com/healthy-sugars-8422496
3,9 Best Over-The-Counter Hearing Aids,Medical Products & Services,https://www.verywellhealth.com/best-hearing-aids-5085525
4,When & Why to Use a Humidifier,"Ear, Nose & Throat",https://www.verywellhealth.com/what-does-a-humidifier-do-8404519
