,title,category,url
0,"Your Pets Can Get COVID-19, Too",Coronavirus News,https://www.verywellhealth.com/pets-animals-covid-5217356
1,How Many Times Can You Reuse Your N95 Mask?,Coronavirus News,https://www.verywellhealth.com/how-many-times-rewear-mask-5217510
2,More Than Melanin: Skin Cancer Is Still a Risk for the Black Community,Health News,https://www.verywellhealth.com/skin-cancer-risk-black-community-5217914
3,Heart Disease: Men vs. Women,Heart Health,https://www.verywellhealth.com/heart-disease-men-vs-women-4126017
4,What You Should Know About Your Mammogram,Cancer,https://www.verywellhealth.com/mammogram-what-to-expect-430283
