,title,category,url
0,"6 Essential Tips for Lowering Blood Pressure, According to New Guidelines",Health News,https://www.verywellhealth.com/takeaways-from-new-blood-pressure-guidelines-11793479
1,Heart Disease: Overview and More,American Heart Month,https://www.verywellhealth.com/heart-disease-4014709
2,What Happens to Your Heart When You Take These 8 Supplements,Supplements,https://www.verywellhealth.com/heart-health-supplements-11880841
3,What's New in the Latest Dietary Guidelines?,Studies and Guidelines ,https://www.verywellhealth.com/dietary-guidelines-whats-new-11891228
4,I Thought I Was Just Tired—Then I Found Out I Had a Vitamin D Deficiency,Supplements,https://www.verywellhealth.com/vitamin-d-deficiency-11882645
