,title,category,url
0,What's New in Colon Cancer Prevention?,Health News,https://www.verywellhealth.com/whats-new-in-colon-cancer-prevention-11684294
1,Living Fully With Metastatic Breast Cancer,Feature,https://www.verywellhealth.com/living-with-metastatic-breast-cancer-8787598
2,Eli Lilly Lowers Cost of Zepbound Vials to Attract People Without Insurance Coverage,Health News,https://www.verywellhealth.com/lilly-zepbound-vials-price-cuts-11687863
3,"Bacterial Vaginosis May Be Sexually Transmitted, New Study Suggests",Health News,https://www.verywellhealth.com/is-bacterial-vaginosis-an-sti-11695131
4,Are Microplastics Fueling the Rise of Colorectal Cancer in Young Adults?,Health News,https://www.verywellhealth.com/microplastics-colorectal-cancer-11692036
