,title,category,url
0,Gender-Affirming Care Bans Harm More Than Just the Trans Community,Health News,https://www.verywellhealth.com/ripple-effects-gender-affirming-care-bans-7555097
1,Early Prime Day Deals on Blood Pressure Monitors,Medical Products & Services,https://www.verywellhealth.com/best-blood-pressure-monitors-4158050
2,What Is a ‘Margarita Burn’ and How Long Does It Last?,Health News,https://www.verywellhealth.com/what-is-margarita-burn-7551950
3,How to Safely Light Fireworks,First Aid,https://www.verywellhealth.com/fireworks-safety-1298803
4,Sleep Apnea Treatment: With and Without CPAP,Sleep Disorders,https://www.verywellhealth.com/sleep-apnea-treatment-7549716
5,Menopause and Black Women,Health Divide,https://www.verywellhealth.com/health-divide-menopause-and-black-women-7498526
