,title,category,url
0,What Pandemic Lessons Can Be Applied to the Climate Crisis?,Health News,https://www.verywellhealth.com/covid-pandemic-climate-change-lessons-learned-5199083
1,Biden’s Assertive COVID-19 Vaccination Plan Will Affect Most Americans,Coronavirus News,https://www.verywellhealth.com/biden-covid-19-strategy-5200945
2,This OB-GYN Is Using TikTok to Educate People on Abortion Resources,Health News,https://www.verywellhealth.com/obgyn-tiktok-abortion-care-resources-5200816
3,Is Extreme Heat Making Your Asthma Worse?,Asthma,https://www.verywellhealth.com/extreme-weather-and-summer-asthma-whats-important-200527
4,Here's What a Prostate Test Can Tell You,Cancer,https://www.verywellhealth.com/understanding-your-psa-results-2781985
