,title,category,url
0,Major Travel Authorities Drop Mask Mandate Following Court Ruling,Coronavirus News,https://www.verywellhealth.com/court-threw-out-travel-mask-mandate-5235578
1,FDA Approves Weekly Skin Patch to Treat Dementia,Health News,https://www.verywellhealth.com/skin-patch-dementia-5235268
2,What You Need to Know About New Omicron Subvariants,Coronavirus News,https://www.verywellhealth.com/omicron-sub-subvariants-5235800
3,How Thyroid Eye Disease Is Treated,Eye Health,https://www.verywellhealth.com/thyroid-eye-disease-treatment-5116442
4,How to Treat Psoriasis Itch Without Hurting the Skin,Skin Health,https://www.verywellhealth.com/psoriasis-how-to-tame-the-itch-but-not-make-the-rash-worse-3891347
