,title,category,url
0,PsA and Your Life: A Guide to Your Daily Well-Being,Arthritis,https://www.verywellhealth.com/psa-and-your-life-11802446
1,What Vaccines Do You Need as an Adult?,,https://www.verywellhealth.com/vaccinations-for-adults-11768101
2,Breast Cancer Awareness Month: From Self-Exams to Screening Tests,Cancer,https://www.verywellhealth.com/breast-cancer-testing-screening-5204528
3,What You Need to Know About Getting a Flu Shot This Fall,Health News,https://www.verywellhealth.com/flu-shots-2025-11807542
4,Why Strength Training Could Help Reduce Breast Cancer Risk,Health News,https://www.verywellhealth.com/breast-cancer-and-strength-training-11743655
