,title,category,url
0,BMI Is Outdated. A New Index Can Tell You More About Your Health,Health News,https://www.verywellhealth.com/body-roundness-index-8755058
1,The First Steps to Managing Crohn’s Disease,Feature,https://www.verywellhealth.com/the-first-steps-to-managing-crohns-disease-8740759
2,"Flu, COVID, and RSV: What You Need to Know This Week",Health News,https://www.verywellhealth.com/flu-covid-rsv-tracker-early-december-8754650
3,The 9 Best Magnesium Supplements of 2024,Nutrition Products & Services,https://www.verywellhealth.com/best-magnesium-supplements-8579258
4,Are Seed Oils Bad for You? Here's What the Science Shows,Health News,https://www.verywellhealth.com/are-seed-oils-bad-for-you-8748907
