,title,category,url
0,How Lifting Restrictions on Gay and Bisexual Men Could Bolster Blood Supply,Health News,https://www.verywellhealth.com/blood-donation-supply-gay-bisexual-men-7098364
1,I Tried the 12-3-30 Workout. I Won't Do It 5 Days a Week Again.,Health News,https://www.verywellhealth.com/12-3-30-workout-tiktok-7099592
2,Why Listening to Pop Music Can Help You Fall Asleep,Health News,https://www.verywellhealth.com/can-pop-music-help-you-fall-asleep-7100814
3,Is the Green Mediterranean Diet Healthier?,Health News,https://www.verywellhealth.com/green-mediterranean-diet-7100479
4,Save Up to $700 on Mattresses From Top Brands With These Presidents' Day Sales,News,https://www.verywellhealth.com/presidents-day-mattress-sales-7104048
5,The Aging Well Issue featuring Fran Drescher,The Digital Issue,https://www.verywellhealth.com/the-aging-well-issue-featuring-fran-drescher-6824283
