,title,category,url
0,What Happens When You Stop Losing Weight on Drugs Like Ozempic or Wegovy?,Health News,https://www.verywellhealth.com/weight-loss-plateau-ozempic-wegovy-8580412
1,The Verywell Health Impact Awards,Health Advocates,https://www.verywellhealth.com/impact-awards-2023-7969442
2,Alabama Ruling Threatens IVF by Classifying Lab Embryos as Children,Health News,https://www.verywellhealth.com/alabama-frozen-embryo-ruling-8598784
3,Oily Hair: What Causes Wet and Shiny Symptoms?,Skin Health,https://www.verywellhealth.com/oily-hair-8550323
4,The 10 Best Contact Lens Solutions,Eye Care Products,https://www.verywellhealth.com/best-contact-lens-solutions-4580534
