,title,category,url
0,Should You Get Another Mpox Vaccine Dose?,Health News,https://www.verywellhealth.com/should-you-get-an-additional-mpox-vaccine-8700926
1,Endometriosis Self-Care Center,Feature,https://www.verywellhealth.com/endometriosis-self-care-8598163
2,"Your Body Gets Much Older at These Two Ages, Study Shows",Health News,https://www.verywellhealth.com/aging-bursts-study-8700504
3,5 Best Supplements for IBS,Supplements,https://www.verywellhealth.com/best-supplements-for-ibs-7097416
4,Fall Vaccine Planning Guide,Coronavirus News,https://www.verywellhealth.com/vaccine-planning-guide-2024-2025-8699558
