,title,category,url
0,FDA Recommends Booster Shots for Omicron Subvariants,Coronavirus News,https://www.verywellhealth.com/covid-bivalent-vaccine-omicron-subvariant-5525630
1,The Preventive Health Issue Featuring Jonathan Van Ness,Health News,https://www.verywellhealth.com/the-preventive-health-issue-featuring-jonathan-van-ness-5323939
2,How Much Sleep Do You Need For a Healthy Heart?,Health News,https://www.verywellhealth.com/are-you-sleeping-enough-for-your-heart-5525318
3,The Best Health Deals On Amazon Prime Day 2022,Health News,https://www.verywellhealth.com/best-amazon-prime-day-deals-5410306
4,Are Home Pulse Oximeters Useful for COVID Recovery?,Coronavirus News,https://www.verywellhealth.com/covid-home-pulse-oximeter-use-research-mixed-5525551
