,title,category,url
0,988 Is the New National Mental Health Hotline,Health News,https://www.verywellhealth.com/988-suicide-prevention-hotline-5547790
1,What Are the Symptoms of Omicron BA.5?,Coronavirus News,https://www.verywellhealth.com/omicron-ba5-symptoms-5537119
2,Novavax COVID-19 Vaccines Are Here,Coronavirus News,https://www.verywellhealth.com/fda-panel-recommends-novavax-covid-vaccine-5218212
3,How to Enjoy Swimming Pools Without Getting Sick,Health News,https://www.verywellhealth.com/swimming-pools-germs-diarrhea-5547129
4,Who Needs a 3D Mammogram?,Health News,https://www.verywellhealth.com/who-needs-3d-mammogram-5525428
