,title,category,url
0,Fauci Says Trick-or-Treating Is a Go This Year,Coronavirus News,https://www.verywellhealth.com/halloween-covid-safety-5206517
1,Is It Fall Allergies or COVID-19?,Coronavirus News,https://www.verywellhealth.com/fall-allergies-or-covid-5206404
2,CDC Endorses Boosters For All 3 COVID Vaccines,Coronavirus News,https://www.verywellhealth.com/cdc-boosters-moderna-johnson-and-johnson-5206847
3,Health Divide: Breast Cancer and Black Women,Cancer,https://www.verywellhealth.com/black-health-spotlight-breast-cancer-5196740
4,Your 'Digital Twin' Could Help Control Type 2 Diabetes,Health News,https://www.verywellhealth.com/type-2-diabetes-digital-twin-5206096
