,title,category,url
0,What You Need to Know About the Updated COVID-19 Boosters,Coronavirus News,https://www.verywellhealth.com/updated-covid-19-booster-omicron-variants-6544764
1,Here's Why Scientists Say You Should Kill Spotted Lanternflies,Health News,https://www.verywellhealth.com/spotted-lanternfly-6500716
2,Want to Donate Blood? Check Your Hemoglobin Levels First,Health News,https://www.verywellhealth.com/hemogoblin-iron-deficiency-blood-donation-6614074
3,Tracker: Polio in the U.S.,Health News,https://www.verywellhealth.com/polio-case-tracker-6374398
4,Monkeypox by the Numbers,Health News,https://www.verywellhealth.com/monkeypox-rates-by-state-6272347
5,The Preventive Health Issue Featuring Jonathan Van Ness,The Digital Issue,https://www.verywellhealth.com/the-preventive-health-issue-featuring-jonathan-van-ness-5323939
